{
  "bdd_scenarios": [
    {
      "scenario_id": "BDD-LOGIN-001",
      "feature": "User Authentication",
      "given": ["User is on the login page"],
      "when": ["User enters valid credentials and clicks login"],
      "then": ["User is redirected to dashboard"]
    }
  ],
  "wireframes": [
    {
      "screen_id": "login",
      "title": "Login Screen",
      "elements": ["email input", "password input", "login button", "forgot password link"]
    },
    {
      "screen_id": "dashboard",
      "title": "Dashboard",
      "elements": ["header with user menu", "sidebar navigation", "main content area"]
    }
  ],
  "design_tokens": {
    "colors": {
      "primary": "#0066CC",
      "success": "#00A86B",
      "error": "#DC2626"
    },
    "spacing": {
      "xs": "0.5rem",
      "sm": "1rem",
      "md": "1.5rem"
    }
  },
  "api_contracts": [
    {
      "endpoint": "POST /api/v1/auth/login",
      "response": { "token": "string" }
    }
  ],
  "navigation_structure": {
    "routes": [
      { "path": "/login", "component": "LoginPage" },
      { "path": "/dashboard", "component": "DashboardPage" }
    ]
  }
}
